{
  "$schema": "https://json-schema.org/draft/2020-12/schema",
  "$id": "openmathmodel.contracts.v1.experiment-summary",
  "title": "ExperimentSummary",
  "description": "实验与验证页正文投影：EXPERIMENTING 阶段真实节点（LLM 生成代码 + python 沙箱执行）的最新成功输出；validation 为同页 VALIDATING 阶段的检验报告，检验未完成时为 null。",
  "type": "object",
  "properties": {
    "run_id": { "$ref": "#/$defs/run_id" },
    "approach_summary": {
      "type": "string",
      "description": "实现思路摘要（算法、数据构造方式、评估口径）。"
    },
    "metrics": {
      "type": "object",
      "description": "实验脚本按 OMM_METRICS_JSON 标记行打印的核心指标（自由载荷：指标名 → 数值），消费方容忍未知指标名；脚本未打印时为空对象。"
    },
    "stdout_tail": {
      "type": "string",
      "description": "实验脚本标准输出尾部（节点侧截断）。"
    },
    "experiment_summary": {
      "type": "string",
      "description": "实验过程摘要（思路 + 核心指标 + 产物文件），供检验与论文阶段引用。"
    },
    "validation": {
      "oneOf": [
        { "type": "null" },
        { "$ref": "#/$defs/validation_report" }
      ],
      "description": "VALIDATING 阶段的检验报告（评审判读 + 沙盒复跑的稳健性检查）；该阶段未成功完成时为 null。"
    },
    "review": {
      "oneOf": [
        { "type": "null" },
        { "$ref": "#/$defs/review_report" }
      ],
      "description": "实验代码的独立审稿结论（生成者-评审者环：节点确定性复跑核对 + 只读审稿子代理；驳回退修、修不动即僵持交 G3 裁定）。实验节点未产出该字段（审稿环之前的运行、模拟节点）时为 null。可选字段：旧消费者可忽略。"
    },
    "figures": {
      "type": "array",
      "items": { "$ref": "#/$defs/experiment_figure" },
      "description": "实验 / 检验阶段沙盒真实落盘并被采集的图件清单（实验图先编号、检验图其后，与论文节点的图件清单同一编号规则；论文阶段补画的图不在此列）。没有图件为空列表。可选字段：该字段出现之前的消费者可忽略。"
    },
    "updated_at": { "$ref": "#/$defs/timestamp" }
  },
  "required": [
    "run_id",
    "approach_summary",
    "metrics",
    "stdout_tail",
    "experiment_summary",
    "validation",
    "updated_at"
  ],
  "additionalProperties": false,
  "$defs": {
    "run_id": { "type": "string", "pattern": "^run_[0-9a-f]{32}$" },
    "timestamp": {
      "type": "string",
      "pattern": "^\\d{4}-\\d{2}-\\d{2}T\\d{2}:\\d{2}:\\d{2}(\\.\\d{1,6})?Z$",
      "description": "UTC ISO-8601，统一以 Z 结尾。"
    },
    "verdict": {
      "type": "string",
      "enum": ["pass", "concerns", "fail"],
      "description": "检验总体结论：pass 可信 / concerns 可用但有保留 / fail 不可信需重做。"
    },
    "validation_check": {
      "type": "object",
      "properties": {
        "name": { "type": "string", "description": "检查名（结果合理性、稳健性等）。" },
        "result": {
          "type": "string",
          "enum": ["pass", "warn", "fail"],
          "description": "该项检查结论。"
        },
        "note": { "type": "string", "description": "依据，一句话。" }
      },
      "required": ["name", "result", "note"],
      "additionalProperties": false
    },
    "validation_report": {
      "type": "object",
      "properties": {
        "verdict": { "$ref": "#/$defs/verdict" },
        "checks": {
          "type": "array",
          "items": { "$ref": "#/$defs/validation_check" },
          "description": "逐项检查列表（评审判读，模型给出）。"
        },
        "risks": {
          "type": "array",
          "items": { "type": "string" },
          "description": "主要风险与失效条件；节点未给出时为空列表。"
        },
        "validation_summary": {
          "type": "string",
          "description": "一段话的检验结论（如实包含保留意见），供论文阶段引用。"
        },
        "robustness": {
          "oneOf": [
            { "type": "null" },
            { "$ref": "#/$defs/robustness_report" }
          ],
          "description": "沙盒复跑的稳健性检查（G3 结果采用闸门的判定依据），数字来自检验脚本的标记行而非模型转述；验证节点未产出该字段（沙盒化之前的运行、模拟节点）时为 null。可选字段：旧消费者可忽略。"
        }
      },
      "required": ["verdict", "checks", "risks", "validation_summary"],
      "additionalProperties": false
    },
    "robustness_check": {
      "type": "object",
      "properties": {
        "id": { "type": "string", "description": "检查项 id（脚本自定，稳定可引用）。" },
        "name": { "type": "string", "description": "检查名（扰动敏感性、重采样稳定性、对基线优势幅度等）。" },
        "passed": { "type": "boolean", "description": "是否达标：脚本按写死在代码里的阈值判定。" },
        "value": {
          "type": ["number", "null"],
          "description": "实测值（来自标记行）；脚本未给数值时为 null。"
        },
        "threshold": {
          "type": ["number", "string", "null"],
          "description": "判定阈值：数值，或脚本给出的文字口径（如「≤ 0.05」）；未给时为 null。"
        },
        "detail": { "type": "string", "description": "依据，一句话；无则空串。" },
        "assumption_id": {
          "type": ["string", "null"],
          "description": "该检查针对的模型假设编号（plan-proposal.assumptions[].id，如 A1 / G2）；通用检查或方案阶段未生成假设表时为 null。可选字段：旧消费者可忽略。"
        }
      },
      "required": ["id", "name", "passed", "value", "threshold", "detail"],
      "additionalProperties": false
    },
    "robustness_report": {
      "type": "object",
      "properties": {
        "executed": {
          "type": "boolean",
          "description": "沙盒复跑是否真的执行过。false 时 checks 为空列表、reason 说明原因（工具 / 监督者 / 会话出口 / 实验脚本 / 预算任一缺席，或子代理未完成）。"
        },
        "status": {
          "type": ["string", "null"],
          "description": "沙盒会话终态（sandbox-run-report 的 status，如 passed / failed）；未执行时为 null。非 passed 时 checks 为空、G3 不触发。"
        },
        "summary_text": {
          "type": "string",
          "description": "供论文引用的一句话稳健性结论，数字只来自标记行（不是模型转述）；未执行时为空串。"
        },
        "checks": {
          "type": "array",
          "items": { "$ref": "#/$defs/robustness_check" },
          "description": "逐项稳健性检查；未执行或复跑未成功时为空列表。"
        },
        "checks_total": { "type": "integer", "minimum": 0, "description": "检查项总数（= checks 长度）。" },
        "checks_failed": { "type": "integer", "minimum": 0, "description": "未通过项数；≥1 即触发 G3 结果采用闸门。" },
        "reason": {
          "type": "string",
          "description": "未执行 / 未完成的原因（executed=false 时非空）；执行成功时为空串。"
        },
        "review": {
          "oneOf": [
            { "type": "null" },
            { "$ref": "#/$defs/review_report" }
          ],
          "description": "检验脚本的独立审稿结论（同实验代码的生成者-评审者环；僵持时 G3 多一个「重做检验」选项）。复跑未执行、或验证节点未产出该字段（审稿环之前的运行）时为 null。可选字段：旧消费者可忽略。"
        },
        "round_comparison": {
          "oneOf": [
            { "type": "null" },
            { "$ref": "#/$defs/round_comparison" }
          ],
          "description": "回退重做（人工 redo / 修订 / 图的条件边自动回退）后的复检与上一轮的跨轮对比：上一轮未通过的检查按 id 与本轮求交，分成转为通过 / 仍未通过（带本轮实测与阈值）/ 本轮未复检三桶，只计数与点名、不判好坏。首轮检验、复跑未执行、上一轮全过或没跑成时为 null。可选字段：旧消费者可忽略。"
        }
      },
      "required": ["executed", "status", "summary_text", "checks", "checks_total", "checks_failed", "reason"],
      "additionalProperties": false
    },
    "review_verdict": {
      "type": "string",
      "enum": ["accept", "reject"],
      "description": "审稿结论：accept 通过 / reject 驳回（驳回成立须至少一条 blocker，否则节点按 accept 记）。"
    },
    "review_finding": {
      "type": "object",
      "properties": {
        "id": { "type": "string", "description": "意见编号（审稿人给出，缺省按序补 R1、R2…）。" },
        "severity": {
          "type": "string",
          "enum": ["blocker", "major", "minor"],
          "description": "严重度：blocker 会让结果不可信（一票驳回的依据）/ major 应修 / minor 建议。"
        },
        "location": { "type": "string", "description": "问题位置（文件 / 函数 / 行）；无则空串。" },
        "issue": { "type": "string", "description": "问题描述，一句话。" },
        "fix_hint": { "type": "string", "description": "修法建议；无则空串。" }
      },
      "required": ["id", "severity", "location", "issue", "fix_hint"],
      "additionalProperties": false
    },
    "review_report": {
      "type": "object",
      "properties": {
        "executed": {
          "type": "boolean",
          "description": "独立审稿是否真的进行过（至少一轮审稿子代理给出了有效终答）。false 时 verdict 为 null、findings 为空、reason 说明原因（未配置监督者 / 预算不足 / 子代理未完成）。"
        },
        "verdict": {
          "oneOf": [
            { "type": "null" },
            { "$ref": "#/$defs/review_verdict" }
          ],
          "description": "最后一轮审稿人的结论；未执行时为 null。"
        },
        "rounds": { "type": "integer", "minimum": 0, "description": "审稿轮数（含驳回修复后的复审）；未派出过为 0。" },
        "findings": {
          "type": "array",
          "items": { "$ref": "#/$defs/review_finding" },
          "description": "最后一轮审稿意见（blocker 在前、同级保序）；未执行时为空列表。"
        },
        "blockers": { "type": "integer", "minimum": 0, "description": "阻断性意见条数（= findings 中 severity=blocker 的条数）。" },
        "summary": { "type": "string", "description": "审稿人的一句话总结；未执行时为空串。" },
        "stalemate": {
          "type": "boolean",
          "description": "僵持：驳回后修复预算已尽 / 修复波未过验收 / 修复后复审未完成 / 达到轮次上限仍有 blocker。true 时保留最后一波通过验收的结果，交由该阶段的人工闸门（结果采用 / 数据确认）裁定。"
        },
        "rerun_consistent": {
          "type": ["boolean", "null"],
          "description": "节点用同一份最终脚本确定性复跑一次并逐键比对该阶段的关键数字（实验 / 检验：核心指标；清洗：影响面标记行）：true 一致 / false 不一致（可复现性存疑）/ null 未复跑（预算不足或脚本正文缺失）。"
        },
        "reason": {
          "type": "string",
          "description": "未执行或僵持的原因；正常通过时为空串。"
        }
      },
      "required": ["executed", "verdict", "rounds", "findings", "blockers", "summary", "stalemate", "rerun_consistent", "reason"],
      "additionalProperties": false
    },
    "experiment_figure_stage": {
      "type": "string",
      "enum": ["EXPERIMENTING", "VALIDATING"],
      "description": "图件的来源阶段：实验运行沙盒 / 结果验证（稳健性复跑）沙盒。"
    },
    "experiment_figure": {
      "type": "object",
      "properties": {
        "number": { "type": "integer", "minimum": 1, "description": "全文统一编号「图 N」（实验图先、检验图后，文件名去重）。" },
        "name": { "type": "string", "description": "图件文件名（basename）。" },
        "artifact_id": {
          "type": ["string", "null"],
          "description": "图件产物 id（/api/v1/artifacts/{id}/download 可取图）；未登记为 null，消费者不得拼下载链接。"
        },
        "caption": { "type": "string", "description": "画图工程师在终答里给的一句说明；未给为空串。" },
        "source_stage": { "$ref": "#/$defs/experiment_figure_stage" }
      },
      "required": ["number", "name", "artifact_id", "caption", "source_stage"],
      "additionalProperties": false
    },
    "round_check_ref": {
      "type": "object",
      "properties": {
        "id": { "type": "string", "minLength": 1, "description": "检查项 id（与 robustness_check.id 同一命名空间）。" },
        "name": { "type": "string", "description": "检查名；上一轮未给名时回落为 id。" }
      },
      "required": ["id", "name"],
      "additionalProperties": false
    },
    "round_check_result": {
      "type": "object",
      "properties": {
        "id": { "type": "string", "minLength": 1, "description": "检查项 id。" },
        "name": { "type": "string", "description": "检查名。" },
        "value": {
          "type": ["number", "null"],
          "description": "本轮实测值（来自标记行）；脚本未给数值时为 null。"
        },
        "threshold": {
          "type": ["number", "string", "null"],
          "description": "本轮判定阈值（数值或文字口径）；未给时为 null。跨轮对比要求阈值照旧，消费者可与上一轮对照。"
        }
      },
      "required": ["id", "name", "value", "threshold"],
      "additionalProperties": false
    },
    "round_comparison": {
      "type": "object",
      "properties": {
        "iteration": {
          "type": ["integer", "null"],
          "minimum": 1,
          "description": "这是回退的第几轮（图的迭代许可 iteration）；无许可字段的旧事件 / 人工重做未计轮次时为 null。"
        },
        "auto": {
          "type": "boolean",
          "description": "本轮回退是否由图的条件边自动触发（true）而非人工要求（false）。"
        },
        "previous_total": { "type": "integer", "minimum": 0, "description": "上一轮检查项总数。" },
        "previous_failed": {
          "type": "array",
          "items": { "$ref": "#/$defs/round_check_ref" },
          "description": "上一轮未通过的检查（导致回退的那一批）。"
        },
        "resolved": {
          "type": "array",
          "items": { "$ref": "#/$defs/round_check_ref" },
          "description": "上一轮未过、本轮同 id 复检转为通过的检查。"
        },
        "still_failing": {
          "type": "array",
          "items": { "$ref": "#/$defs/round_check_result" },
          "description": "上一轮未过、本轮同 id 复检仍未通过的检查，带本轮实测与阈值。"
        },
        "not_rechecked": {
          "type": "array",
          "items": { "$ref": "#/$defs/round_check_ref" },
          "description": "上一轮未过、本轮脚本里找不到同 id 检查的项（删检查或改名——审稿人按跨轮核查纪律追问）。"
        }
      },
      "required": ["iteration", "auto", "previous_total", "previous_failed", "resolved", "still_failing", "not_rechecked"],
      "additionalProperties": false
    }
  }
}
