{
  "run_id": "run_1a2b3c4d5e6f708192a3b4c5d6e7f809",
  "approach_summary": "构造合成需求数据，贪心近似求解并与随机基线对比",
  "metrics": { "rmse": 0.5, "improvement_pct": 12.3 },
  "stdout_tail": "OMM_METRICS_JSON: {\"rmse\": 0.5, \"improvement_pct\": 12.3}\n",
  "experiment_summary": "贪心近似求解并与随机基线对比\n核心指标：{\"rmse\": 0.5}\n产物文件：results.csv",
  "validation": {
    "verdict": "concerns",
    "checks": [
      { "name": "结果合理性", "result": "pass", "note": "指标数量级正常" },
      { "name": "稳健性", "result": "warn", "note": "对需求率参数敏感" }
    ],
    "risks": ["合成数据外推风险"],
    "validation_summary": "结果整体可信，但对需求率参数敏感"
  },
  "updated_at": "2026-08-27T01:35:00.000000Z"
}
