{
  "run_id": "run_1a2b3c4d5e6f708192a3b4c5d6e7f809",
  "approach_summary": "构造合成需求数据，贪心近似求解并与随机基线对比",
  "metrics": { "rmse": 0.5, "improvement_pct": 12.3 },
  "stdout_tail": "OMM_METRICS_JSON: {\"rmse\": 0.5, \"improvement_pct\": 12.3}\n",
  "experiment_summary": "贪心近似求解并与随机基线对比\n核心指标：{\"rmse\": 0.5}\n产物文件：results.csv\n独立审稿通过（1 轮，1 条意见）",
  "validation": {
    "verdict": "concerns",
    "checks": [
      { "name": "结果合理性", "result": "pass", "note": "指标数量级正常" },
      { "name": "稳健性", "result": "warn", "note": "对需求率参数敏感" }
    ],
    "risks": ["合成数据外推风险"],
    "validation_summary": "结果整体可信，但对需求率参数敏感",
    "robustness": {
      "executed": true,
      "status": "passed",
      "summary_text": "沙盒复跑稳健性检查 3 项，通过 2 项；未通过：需求率扰动（sensitivity：value 0.25，阈值 0.2）。",
      "checks": [
        { "id": "sensitivity", "name": "需求率扰动", "passed": false, "value": 0.25, "threshold": 0.2, "detail": "超出阈值", "assumption_id": "A1" },
        { "id": "bootstrap", "name": "重采样稳定性", "passed": true, "value": 0.08, "threshold": 0.15, "detail": "在阈值内", "assumption_id": null },
        { "id": "baseline", "name": "对基线优势幅度", "passed": true, "value": 0.6, "threshold": "≥ 0.1", "detail": "" }
      ],
      "checks_total": 3,
      "checks_failed": 1,
      "reason": "",
      "review": {
        "executed": true,
        "verdict": "reject",
        "rounds": 2,
        "findings": [
          {
            "id": "R1",
            "severity": "blocker",
            "location": "robustness.py:perturb()",
            "issue": "扰动只作用在训练集，评估集未同步扰动，敏感性数值偏乐观",
            "fix_hint": "扰动后重新切分并同时评估"
          },
          {
            "id": "R2",
            "severity": "minor",
            "location": "",
            "issue": "阈值 0.2 未说明来源",
            "fix_hint": ""
          }
        ],
        "blockers": 1,
        "summary": "扰动实现有缺陷，敏感性结论不能采信",
        "stalemate": true,
        "rerun_consistent": true,
        "reason": "审稿 2 轮后仍有阻断性意见未解决"
      }
    }
  },
  "review": {
    "executed": true,
    "verdict": "accept",
    "rounds": 1,
    "findings": [
      {
        "id": "R1",
        "severity": "minor",
        "location": "experiment.py:12",
        "issue": "随机种子写死在脚本里，建议改为常量集中管理",
        "fix_hint": "抽成 SEED 常量"
      }
    ],
    "blockers": 0,
    "summary": "实现忠实于方案 A，指标口径与方案一致，可复现",
    "stalemate": false,
    "rerun_consistent": true,
    "reason": ""
  },
  "figures": [
    {
      "number": 1,
      "name": "fit_vs_baseline.png",
      "artifact_id": "art_8f2a1c3d4e5b",
      "caption": "贪心解与随机基线的目标值对比",
      "source_stage": "EXPERIMENTING"
    },
    {
      "number": 2,
      "name": "convergence.svg",
      "artifact_id": null,
      "caption": "",
      "source_stage": "EXPERIMENTING"
    },
    {
      "number": 3,
      "name": "sensitivity.png",
      "artifact_id": "art_9a3b2d4e5f6c",
      "caption": "需求率 ±20% 扰动下的 rmse 变化",
      "source_stage": "VALIDATING"
    }
  ],
  "updated_at": "2026-09-06T12:00:00.000000Z"
}
